<Job_Order schemaName="ESA-EOPG-EEGS-ID-0083" schemaVersion="1.0" xmlns:xsi="http://www.w3.org/2001/XMLSchema-instance" xsi:noNamespaceSchemaLocation="job_order_ESA-EOPG-EEGS-ID-0083.xsd">
  <Processor_Configuration>
    <File_Class>Todo</File_Class>
    <Processor_Name>l1_sta</Processor_Name>
    <Processor_Version>01.01</Processor_Version>
    <Processing_Node>MyNode</Processing_Node>
    <List_of_Stdout_Log_Levels>
      <Stdout_Log_Level>ERROR</Stdout_Log_Level>
      <Stdout_Log_Level>WARNING</Stdout_Log_Level>
      <Stdout_Log_Level>PROGRESS</Stdout_Log_Level>
      <Stdout_Log_Level>INFO</Stdout_Log_Level>
    </List_of_Stdout_Log_Levels>
    <List_of_Stderr_Log_Levels />
    <Intermediate_Output_Enable>true</Intermediate_Output_Enable>
    <Processing_Station>GAT</Processing_Station>
    <Request />
  </Processor_Configuration>
  <List_of_Tasks>
    <Task>
      <Task_Name>Step1</Task_Name>
      <Task_Version>01.01</Task_Version>
      <Number_of_CPU_Cores>1</Number_of_CPU_Cores>
      <Amount_of_RAM>1073741824</Amount_of_RAM>
      <Disk_Space>1073741824</Disk_Space>
      <List_of_Proc_Parameters>
        <Proc_Parameter>
          <Name>Orbit_Number</Name>
          <Value>1234</Value>
        </Proc_Parameter>
      </List_of_Proc_Parameters>
      <List_of_Cfg_Files />
      <List_of_Inputs>
        <Input>
          <Input_ID />
          <Alternative_ID />
          <List_of_Selected_Inputs>
            <Selected_Input>
              <File_Type>Sx_SCS__1S</File_Type>
              <List_of_File_Names>
                <File_Name>./BIO_S1_SCS__1S_20210201T002533_20210201T002554_T_G___M01_C01_T000_F001_00_??????</File_Name>
                <File_Name>./BIO_S1_SCS__1S_20210201T002533_20210201T002554_T_G___M01_C02_T000_F001_00_??????</File_Name>
                <File_Name>./BIO_S1_SCS__1S_20210201T002533_20210201T002554_T_G___M01_C03_T000_F001_00_??????</File_Name>
              </List_of_File_Names>
            </Selected_Input>
          </List_of_Selected_Inputs>
        </Input>
        <Input>
          <Input_ID />
          <Alternative_ID />
          <List_of_Selected_Inputs>
            <Selected_Input>
              <File_Type>AUX_PPS___</File_Type>
              <List_of_File_Names>
                <File_Name>./BIO_AUX_PPS____20210201T000000_20210201T013810_01_??????</File_Name>
              </List_of_File_Names>
            </Selected_Input>
          </List_of_Selected_Inputs>
        </Input>
      </List_of_Inputs>
      <List_of_Outputs>
        <Output>
          <File_Type>Sx_STA__1S</File_Type>
          <File_Name_Pattern />
          <File_Dir>./</File_Dir>
          <Baseline>00</Baseline>
        </Output>
        <Output>
          <File_Type>Sx_STA__1M</File_Type>
          <File_Name_Pattern />
          <File_Dir>./</File_Dir>
          <Baseline>00</Baseline>
        </Output>
      </List_of_Outputs>
      <List_of_Intermediate_Outputs>
        <Intermediate_Output>
          <Intermediate_Output_ID>1</Intermediate_Output_ID>
          <Intermediate_Output_File>./tempfile_1</Intermediate_Output_File>
        </Intermediate_Output>
        <Intermediate_Output>
          <Intermediate_Output_ID>2</Intermediate_Output_ID>
          <Intermediate_Output_File>./tempfile_2</Intermediate_Output_File>
        </Intermediate_Output>
      </List_of_Intermediate_Outputs>
    </Task>
  </List_of_Tasks>
</Job_Order>
