<Job_Order xmlns:xsi="http://www.w3.org/2001/XMLSchema-instance" schemaName="ESA-EOPG-EEGS-ID-0083" schemaVersion="1.0" xsi:noNamespaceSchemaLocation="job_order_ESA-EOPG-EEGS-ID-0083.xsd">
  <Processor_Configuration>
    <File_Class>Todo</File_Class>
    <Processor_Name>l0preproc_smStep2</Processor_Name>
    <Processor_Version>01.01</Processor_Version>
    <Processing_Node>MyNode</Processing_Node>
    <List_of_Stdout_Log_Levels>
      <Stdout_Log_Level>ERROR</Stdout_Log_Level>
      <Stdout_Log_Level>WARNING</Stdout_Log_Level>
      <Stdout_Log_Level>PROGRESS</Stdout_Log_Level>
      <Stdout_Log_Level>INFO</Stdout_Log_Level>
    </List_of_Stdout_Log_Levels>
    <List_of_Stderr_Log_Levels />
    <Intermediate_Output_Enable>true</Intermediate_Output_Enable>
    <Processing_Station>GAT</Processing_Station>
    <Request />
  </Processor_Configuration>
  <List_of_Tasks>
    <Task>
      <Task_Name>Step2</Task_Name>
      <Task_Version>05.03</Task_Version>
      <Number_of_CPU_Cores>1</Number_of_CPU_Cores>
      <Amount_of_RAM>1073741824</Amount_of_RAM>
      <Disk_Space>1073741824</Disk_Space>
      <List_of_Proc_Parameters>
        <Proc_Parameter>
          <Name>Product_Counter</Name>
          <Value>0</Value>
        </Proc_Parameter>
        <Proc_Parameter>
          <Name>Processing_Stage_Flag</Name>
          <Value>N</Value>
        </Proc_Parameter>
        <Proc_Parameter>
          <Name>originator_ID</Name>
          <Value>TST</Value>
        </Proc_Parameter>
        <Proc_Parameter>
          <Name>Orbit_Number</Name>
          <Value>37847</Value>
        </Proc_Parameter>
        <Proc_Parameter>
          <Name>Acquisition_Station</Name>
          <Value>ESRIN</Value>
        </Proc_Parameter>
      </List_of_Proc_Parameters>
      <List_of_Cfg_Files />
      <List_of_Inputs>
        <Input>
          <Input_ID />
          <Alternative_ID />
          <List_of_Selected_Inputs>
            <Selected_Input>
              <File_Type>RWS_H1PCAL</File_Type>
              <List_of_File_Names>
                <File_Name>./temp/FLX_RWS_H1PCAL_20170101T060131_20170101T060344_20210201T013810_0133_012_046_0090_1B</File_Name>
                <File_Name>./temp/FLX_RWS_H1PCAL_20170101T060231_20170101T060706_20210201T013810_0275_012_046_0150_1B</File_Name>
              </List_of_File_Names>
            </Selected_Input>
          </List_of_Selected_Inputs>
        </Input>
        <Input>
          <Input_ID />
          <Alternative_ID />
          <List_of_Selected_Inputs>
            <Selected_Input>
              <File_Type>RWS_H1PVAU</File_Type>
              <List_of_File_Names>
                <File_Name>./temp/FLX_RWS_H1PVAU_20170101T083812_20170101T093812_20210201T013810_2801_012_046_3090_1B</File_Name>
                <File_Name>./temp/FLX_RWS_H1PVAU_20170101T073812_20170101T083812_20210201T013810_2801_012_046_3090_1B</File_Name>
              </List_of_File_Names>
            </Selected_Input>
          </List_of_Selected_Inputs>
        </Input>
        <Input>
          <Input_ID />
          <Alternative_ID />
          <List_of_Selected_Inputs>
            <Selected_Input>
              <File_Type>RWS_LRPOBS</File_Type>
              <List_of_File_Names>
                <File_Name>./temp/FLX_RWS_LRPOBS_20170101T060601_20170101T060620_20210201T013810_0019_012_046_0360_1B</File_Name>
                <File_Name>./temp/FLX_RWS_LRPOBS_20170101T060620_20170101T060630_20210201T013810_0019_012_046_0360_1B</File_Name>
              </List_of_File_Names>
            </Selected_Input>
          </List_of_Selected_Inputs>
        </Input>
      </List_of_Inputs>
      <List_of_Outputs>
        <Output>
          <File_Type>RWS_H1_CAL</File_Type>
          <File_Name_Pattern />
          <File_Dir>workspace</File_Dir>
          <Baseline>00</Baseline>
        </Output>
        <Output>
          <File_Type>RWS_H1_VAU</File_Type>
          <File_Name_Pattern />
          <File_Dir>workspace</File_Dir>
          <Baseline>00</Baseline>
        </Output>
        <Output>
          <File_Type>RWS_LR_OBS</File_Type>
          <File_Name_Pattern />
          <File_Dir>workspace</File_Dir>
          <Baseline>00</Baseline>
        </Output>
      </List_of_Outputs>
      <List_of_Intermediate_Outputs>
      </List_of_Intermediate_Outputs>
    </Task>
  </List_of_Tasks>
</Job_Order>